<!DOCTYPE Combination  SYSTEM 'Combination.dtd'>
<Combination>
  <Channel Name="combined" IsCombined="true" Mass="125.5"> <!-- is combined file -->
    <File Name="/xdata10/hji/autumn/eps0/output/hsg12345/125.5_hsg12345.xml_125.5.root"/>
    <Workspace Name="combWS"/>
    <ModelConfig  Name="ModelConfig"/>
    <ModelData Name="combData"/>
    <ModelPOI Name="m_H[120~130], RF[0~5], RV[-5~5]"/>
  </Channel>
  <Channel Name="Cat_CMS_hgg">
    <File Name="workspace/lhchcg/myrep/cms/decorated/hgg.mH.prefit.asimov_decorated.root"/>
    <Workspace Name="combWS"/>
    <ModelConfig Name="ModelConfig"/>
    <ModelPOI Name="MH, RF, RV"/>
    <ModelData Name="combData"/>
    <RenameMap>
      <Syst OldName =               "CMS_eff_b"	NewName =               "CMS_eff_b" />
      <Syst OldName =               "CMS_eff_e"	NewName =               "CMS_eff_e" />
      <Syst OldName =               "CMS_eff_j"	NewName =               "CMS_eff_j" />
      <Syst OldName =               "CMS_eff_m"	NewName =               "CMS_eff_m" />
      <Syst OldName =              "CMS_hgg_BR"	NewName =              "BR_gamgam" />
      <Syst OldName =        "CMS_hgg_n_id_eff"	NewName =        "CMS_hgg_n_id_eff" />
      <Syst OldName =        "CMS_hgg_n_id_mva"	NewName =        "CMS_hgg_n_id_mva" />
      <Syst OldName =         "CMS_hgg_n_pdf_1"	NewName =         "CMS_hgg_n_pdf_1" />
      <Syst OldName =        "CMS_hgg_n_pdf_10"	NewName =        "CMS_hgg_n_pdf_10" />
      <Syst OldName =        "CMS_hgg_n_pdf_11"	NewName =        "CMS_hgg_n_pdf_11" />
      <Syst OldName =        "CMS_hgg_n_pdf_12"	NewName =        "CMS_hgg_n_pdf_12" />
      <Syst OldName =        "CMS_hgg_n_pdf_13"	NewName =        "CMS_hgg_n_pdf_13" />
      <Syst OldName =        "CMS_hgg_n_pdf_14"	NewName =        "CMS_hgg_n_pdf_14" />
      <Syst OldName =        "CMS_hgg_n_pdf_15"	NewName =        "CMS_hgg_n_pdf_15" />
      <Syst OldName =        "CMS_hgg_n_pdf_16"	NewName =        "CMS_hgg_n_pdf_16" />
      <Syst OldName =        "CMS_hgg_n_pdf_17"	NewName =        "CMS_hgg_n_pdf_17" />
      <Syst OldName =        "CMS_hgg_n_pdf_18"	NewName =        "CMS_hgg_n_pdf_18" />
      <Syst OldName =        "CMS_hgg_n_pdf_19"	NewName =        "CMS_hgg_n_pdf_19" />
      <Syst OldName =         "CMS_hgg_n_pdf_2"	NewName =         "CMS_hgg_n_pdf_2" />
      <Syst OldName =        "CMS_hgg_n_pdf_20"	NewName =        "CMS_hgg_n_pdf_20" />
      <Syst OldName =        "CMS_hgg_n_pdf_21"	NewName =        "CMS_hgg_n_pdf_21" />
      <Syst OldName =        "CMS_hgg_n_pdf_22"	NewName =        "CMS_hgg_n_pdf_22" />
      <Syst OldName =        "CMS_hgg_n_pdf_23"	NewName =        "CMS_hgg_n_pdf_23" />
      <Syst OldName =        "CMS_hgg_n_pdf_24"	NewName =        "CMS_hgg_n_pdf_24" />
      <Syst OldName =        "CMS_hgg_n_pdf_25"	NewName =        "CMS_hgg_n_pdf_25" />
      <Syst OldName =        "CMS_hgg_n_pdf_26"	NewName =        "CMS_hgg_n_pdf_26" />
      <Syst OldName =         "CMS_hgg_n_pdf_3"	NewName =         "CMS_hgg_n_pdf_3" />
      <Syst OldName =         "CMS_hgg_n_pdf_4"	NewName =         "CMS_hgg_n_pdf_4" />
      <Syst OldName =         "CMS_hgg_n_pdf_5"	NewName =         "CMS_hgg_n_pdf_5" />
      <Syst OldName =         "CMS_hgg_n_pdf_6"	NewName =         "CMS_hgg_n_pdf_6" />
      <Syst OldName =         "CMS_hgg_n_pdf_7"	NewName =         "CMS_hgg_n_pdf_7" />
      <Syst OldName =         "CMS_hgg_n_pdf_8"	NewName =         "CMS_hgg_n_pdf_8" />
      <Syst OldName =         "CMS_hgg_n_pdf_9"	NewName =         "CMS_hgg_n_pdf_9" />
      <Syst OldName =        "CMS_hgg_n_sc_ggH"	NewName =        "CMS_hgg_n_sc_ggH" />
      <Syst OldName =        "CMS_hgg_n_sc_qqH"	NewName =        "CMS_hgg_n_sc_qqH" />
      <Syst OldName =        "CMS_hgg_n_sigmae"	NewName =        "CMS_hgg_n_sigmae" />
      <Syst OldName =      "CMS_hgg_n_trig_eff"	NewName =      "CMS_hgg_n_trig_eff" />
      <Syst OldName = "CMS_hgg_tth_gluon_splitting"	NewName = "CMS_hgg_tth_gluon_splitting" />
      <Syst OldName = "CMS_hgg_tth_mc_low_stat"	NewName = "CMS_hgg_tth_mc_low_stat" />
      <Syst OldName = "CMS_hgg_tth_parton_shower"	NewName = "CMS_hgg_tth_parton_shower" />
      <Syst OldName =             "CMS_scale_j"	NewName =             "CMS_scale_j" />
      <Syst OldName =  "CMS_scale_j_migration1"	NewName =  "CMS_scale_j_migration1" />
      <Syst OldName =  "CMS_scale_j_migration2"	NewName =  "CMS_scale_j_migration2" />
      <Syst OldName =           "CMS_scale_met"	NewName =           "CMS_scale_met" />
      <Syst OldName =             "QCDscale_VH"	NewName =             "QCDscale_Higgs_VH" />
      <Syst OldName =          "QCDscale_gg2in"	NewName =          "QCDscale_Higgs_gg2in_CMS" />
      <Syst OldName = "QCDscale_gg2in_migration1"	NewName = "QCDscale_Higgs_gg2in_migration1_CMS" />
      <Syst OldName = "QCDscale_gg2in_migration2"	NewName = "QCDscale_Higgs_gg2in_migration2_CMS" />
      <Syst OldName =            "QCDscale_ggH"	NewName =            "QCDscale_Higgs_ggH" />
      <Syst OldName =            "QCDscale_qqH"	NewName =            "QCDscale_Higgs_qqH" />
      <Syst OldName =            "QCDscale_ttH"	NewName =            "QCDscale_Higgs_ttH" />
      <Syst OldName =                    "UEPS"	NewName =                "CMS_UEPS" />
      <Syst OldName =         "UEPS_migration1"	NewName =         "CMS_UEPS_migration1" />
      <Syst OldName =         "UEPS_migration2"	NewName =         "CMS_UEPS_migration2" />
      <Syst OldName =               "lumi_7TeV"	NewName =               "CMS_LUMI_2011" />
      <Syst OldName =               "lumi_8TeV"	NewName =               "CMS_LUMI_2012" />
      <Syst OldName =                  "pdf_gg"	NewName =               "pdf_Higgs_ggH" />
      <Syst OldName =               "pdf_qqbar"	NewName =               "pdf_Higgs_qqH" />
      <Syst OldName = "CMS_hgg_nuisance_EElowR9_7TeVsmear"	NewName = "CMS_hgg_nuisance_EElowR9_7TeVsmear" />
      <Syst OldName = "CMS_hgg_nuisance_eigen1_EElowR9_scale"	NewName = "CMS_hgg_nuisance_eigen1_EElowR9_scale" />
      <Syst OldName = "CMS_hgg_nuisance_NonLinearity_7TeVscale"	NewName = "CMS_hgg_nuisance_NonLinearity_7TeVscale" />
      <Syst OldName = "CMS_hgg_nuisance_EBlowR9Phi_8TeVsmear"	NewName = "CMS_hgg_nuisance_EBlowR9Phi_8TeVsmear" />
      <Syst OldName = "CMS_hgg_nuisance_Geant4_scale"	        NewName = "CMS_hgg_nuisance_Geant4_scale" />
      <Syst OldName = "CMS_hgg_nuisance_EBhighR9Phi_7TeVsmear"	NewName = "CMS_hgg_nuisance_EBhighR9Phi_7TeVsmear" />
      <Syst OldName = "CMS_hgg_nuisance_MaterialEBOuterEE_scale"	NewName = "CMS_hgg_nuisance_MaterialEBOuterEE_scale" />
      <Syst OldName = "CMS_hgg_nuisance_Absolute_scale"	NewName = "CMS_hgg_nuisance_Absolute_scale" />
      <Syst OldName = "CMS_hgg_nuisance_EElowR9_8TeVsmear"	NewName = "CMS_hgg_nuisance_EElowR9_8TeVsmear" />
      <Syst OldName = "CMS_hgg_nuisance_EEhighR9_8TeVsmear"	NewName = "CMS_hgg_nuisance_EEhighR9_8TeVsmear" />
      <Syst OldName = "CMS_hgg_nuisance_eigen1_EEhighR9_scale"	NewName = "CMS_hgg_nuisance_eigen1_EEhighR9_scale" />
      <Syst OldName = "CMS_hgg_nuisance_deltafracright"	NewName = "CMS_hgg_nuisance_deltafracright" />
      <Syst OldName = "CMS_hgg_nuisance_EBhighR9_8TeVsmear"	NewName = "CMS_hgg_nuisance_EBhighR9_8TeVsmear" />
      <Syst OldName = "CMS_hgg_nuisance_EBlowR9Phi_7TeVsmear"	NewName = "CMS_hgg_nuisance_EBlowR9Phi_7TeVsmear" />
      <Syst OldName = "CMS_hgg_nuisance_LightColl_scale"	NewName = "CMS_hgg_nuisance_LightColl_scale" />
      <Syst OldName = "CMS_hgg_nuisance_EBhighR9Phi_8TeVsmear"	NewName = "CMS_hgg_nuisance_EBhighR9Phi_8TeVsmear" />
      <Syst OldName = "CMS_hgg_nuisance_eigen1_EBhighR9_scale"	NewName = "CMS_hgg_nuisance_eigen1_EBhighR9_scale" />
      <Syst OldName = "CMS_hgg_nuisance_eigen2_EBhighR9_scale"	NewName = "CMS_hgg_nuisance_eigen2_EBhighR9_scale" />
      <Syst OldName = "CMS_hgg_nuisance_EBlowR9_7TeVsmear"	NewName = "CMS_hgg_nuisance_EBlowR9_7TeVsmear" />
      <Syst OldName = "CMS_hgg_nuisance_EBhighR9_7TeVsmear"	NewName = "CMS_hgg_nuisance_EBhighR9_7TeVsmear" />
      <Syst OldName = "CMS_hgg_nuisance_eigen2_EElowR9_scale"	NewName = "CMS_hgg_nuisance_eigen2_EElowR9_scale" />
      <Syst OldName = "CMS_hgg_nuisance_eigen2_EBlowR9_scale"	NewName = "CMS_hgg_nuisance_eigen2_EBlowR9_scale" />
      <Syst OldName = "CMS_hgg_nuisance_EEhighR9_7TeVsmear"	NewName = "CMS_hgg_nuisance_EEhighR9_7TeVsmear" />
      <Syst OldName = "CMS_hgg_nuisance_MaterialEBCentral_scale"	NewName = "CMS_hgg_nuisance_MaterialEBCentral_scale" />
      <Syst OldName = "CMS_hgg_nuisance_eigen1_EBlowR9_scale"	NewName = "CMS_hgg_nuisance_eigen1_EBlowR9_scale" />
      <Syst OldName = "CMS_hgg_nuisance_NonLinearity_scale"	NewName = "CMS_hgg_nuisance_NonLinearity_scale" />
      <Syst OldName = "CMS_hgg_nuisance_eigen2_EEhighR9_scale"	NewName = "CMS_hgg_nuisance_eigen2_EEhighR9_scale" />
      <Syst OldName = "CMS_hgg_nuisance_EBlowR9_8TeVsmear"	NewName = "CMS_hgg_nuisance_EBlowR9_8TeVsmear" />

      <Syst OldName=       "CMS_channel" 		NewName=      "Cat_CMS_hgg"/>
    </RenameMap>
  </Channel>
</Combination>
